{
  "manifest_version": "phase5.6",
  "source_name": "ruankaodaren",
  "created_at": "2026-06-02T07:47:59.335Z",
  "manifest_scope": "dry_run_request_manifest_only",
  "generation_allowed": false,
  "dry_run_generation_allowed": false,
  "formal_ai_learning_generation_allowed": false,
  "review_gate_required": true,
  "auto_approval": false,
  "source_layer_modification_allowed": false,
  "official_markdown_modification_allowed": false,
  "source_content_write_allowed": false,
  "phase5_7_entry_allowed": false,
  "item_count": 3,
  "source_packet_gate": {
    "source_packet_exists": true,
    "complete_count": 3,
    "overall_source_packet_status": "complete",
    "gate_result": "pass"
  },
  "output_isolation_policy": {
    "default_output_path": "verification/dry-run/ruankaodaren/baseline/",
    "allowed_output_paths": [
      "verification/dry-run/ruankaodaren/",
      "drafts/ai-learning/ruankaodaren/"
    ],
    "forbidden_output_paths": [
      "docs/ruankaodaren/baseline/",
      "source-packets/",
      "source_content",
      "data/raw",
      "data/intermediate"
    ],
    "source_layer_write_allowed": false,
    "official_markdown_write_allowed": false,
    "source_content_write_allowed": false
  },
  "review_prerequisite_policy": {
    "required_prerequisites": [
      "source_packet_complete",
      "prompt_contract_validated",
      "dry_run_contract_validated",
      "item_eligibility_checked",
      "output_path_isolated",
      "human_review_request_created",
      "no_source_layer_modification",
      "no_official_markdown_modification"
    ],
    "blocking_conditions": [
      "source_packet_incomplete",
      "taxonomy_suspect_without_restriction",
      "asset_without_manual_review",
      "output_path_points_to_source_layer",
      "output_path_points_to_official_markdown",
      "generation_allowed_true",
      "auto_approval_true"
    ],
    "human_review_required": true,
    "auto_approval": false
  },
  "artifact_commit_policy": {
    "commit_allowed": [
      "schema",
      "types",
      "builder",
      "validator",
      "verification_doc",
      "generated_manifest_json",
      "generated_manifest_md"
    ],
    "commit_forbidden": [
      "ai_learning_content",
      "dry_run_content",
      "official_markdown_rewrite",
      "source_layer_modifications",
      "raw_snapshots",
      "intermediate_generated_artifacts",
      "asset_images",
      ".auth",
      "node_modules",
      "pnpm-workspace.yaml"
    ]
  },
  "items": [
    {
      "title": "1.3 指令系统CISC和RISC",
      "render_as": "asset_card",
      "request_status": "not_requested",
      "eligible_for_request": false,
      "dry_run_generation_allowed": false,
      "formal_generation_allowed": false,
      "unrestricted_request_allowed": false,
      "taxonomy_suspect": false,
      "is_multi_card_sequence": false,
      "requires_manual_asset_review": true,
      "requires_manual_review": true,
      "no_ocr": true,
      "no_image_table_reconstruction": true,
      "cannot_claim_image_content_recognized": true,
      "may_request_future_dry_run_after_review": false,
      "required_warnings": [
        "no_ocr",
        "no_image_table_reconstruction",
        "asset_manual_review_required",
        "cannot_claim_image_content_recognized"
      ],
      "eligibility_blockers": [
        "asset_manual_review_required",
        "image_content_not_human_verified"
      ],
      "required_prerequisites": [
        "human_review_request",
        "isolated_output_path",
        "source_packet_reference",
        "prompt_contract_reference",
        "dry_run_contract_reference",
        "manual_asset_review",
        "human_image_content_verification"
      ],
      "output_isolation_path": "verification/dry-run/ruankaodaren/baseline/1.3 指令系统CISC和RISC.request-manifest.json"
    },
    {
      "title": "13.3 软件架构风格",
      "render_as": "short_card",
      "request_status": "not_requested",
      "eligible_for_request": false,
      "dry_run_generation_allowed": false,
      "formal_generation_allowed": false,
      "unrestricted_request_allowed": false,
      "taxonomy_suspect": true,
      "is_multi_card_sequence": true,
      "requires_manual_asset_review": false,
      "requires_manual_review": true,
      "no_ocr": false,
      "no_image_table_reconstruction": false,
      "cannot_claim_image_content_recognized": false,
      "may_request_future_dry_run_after_review": false,
      "required_warnings": [
        "verified_short_text",
        "taxonomy_suspect",
        "multi_card_sequence_possible",
        "do_not_claim_complete"
      ],
      "eligibility_blockers": [
        "taxonomy_suspect",
        "multi_card_sequence_possible",
        "parent_node_not_safe_as_leaf"
      ],
      "required_prerequisites": [
        "human_review_request",
        "isolated_output_path",
        "source_packet_reference",
        "prompt_contract_reference",
        "dry_run_contract_reference",
        "taxonomy_restriction_review",
        "parent_node_review"
      ],
      "output_isolation_path": "verification/dry-run/ruankaodaren/baseline/13.3 软件架构风格.request-manifest.json",
      "taxonomy_suspect_handling": "restrict_request",
      "multi_card_sequence_handling": "do_not_claim_complete",
      "parent_node_handling": "do_not_generate_as_leaf"
    },
    {
      "title": "9.1 信息安全基础知识",
      "render_as": "concept_card",
      "request_status": "not_requested",
      "eligible_for_request": true,
      "dry_run_generation_allowed": false,
      "formal_generation_allowed": false,
      "unrestricted_request_allowed": false,
      "taxonomy_suspect": false,
      "is_multi_card_sequence": false,
      "requires_manual_asset_review": false,
      "requires_manual_review": true,
      "no_ocr": false,
      "no_image_table_reconstruction": false,
      "cannot_claim_image_content_recognized": false,
      "may_request_future_dry_run_after_review": true,
      "required_warnings": [],
      "eligibility_blockers": [],
      "required_prerequisites": [
        "human_review_request",
        "isolated_output_path",
        "source_packet_reference",
        "prompt_contract_reference",
        "dry_run_contract_reference"
      ],
      "output_isolation_path": "verification/dry-run/ruankaodaren/baseline/9.1 信息安全基础知识.request-manifest.json"
    }
  ]
}
